question,combined_answer,combined_score,combined_correct,self_answer,self_score,self_correct,cons_answer,cons_score,cons_correct,token_answer,token_score,token_correct
In which decade of the 20th century was Anne Bancroft born?,the 1930s,0.77,True,1930s,0.75,True,the 1930s,0.7,True,1930s,0.8486,True
The Suez Canal connects the Mediterranean Sea to which other Sea?,red sea,0.73,True,Red Sea,0.95,True,red sea,0.5,True,red sea,0.7259,True
Which rock star did Cindy Crawford name her first son after?,presley,0.62,True,Presley,0.55,True,presley,0.2,True,presley,0.999,True
Sun Yat Sen overthrew the emperor in which country establishing a republic after 2000 years of imperial rule?,china,0.88,True,China,0.95,True,china,0.8,True,china,0.8756,True
Who designed the dress which made the most at Diana's dress auction?,victor edelstein,0.44,True,Charles James,0.59,False,victor edelstein,0.3,True,victor edelstein,0.8766,True
Which Palestinian co-founded al Fatah in 1957?,yasser arafat,0.9,True,Yasser Arafat,0.95,True,yasser arafat,0.8,True,yasser arafat,0.9421,True
In which country was Earl Spencer's acrimonious divorce settlement heard?,england,0.66,False,United Kingdom,0.78,False,england,0.3,False,england,0.851,False
"In which North African country was Mohammed Al-Fayed, owner of Harrods department store in London, born?",egypt,0.85,True,Egypt,0.73,True,egypt,0.9,True,egypt,0.9074,True
Aung San Suu Kyi is a controversial leader in which country?,myanmar burma,0.88,True,Myanmar (Burma),0.85,True,myanmar burma,1.0,True,myanmar,0.8157,True
Which of the founders of United Artists had the last name nearest the beginning of the alphabet?,pickford,0.42,False,"Pickford, Mary",0.73,False,pickford,0.3,False,pickford,0.8301000000000001,False
"In La Cage Aux Folles, what was La Cage Aux Folles?",a drag nightclub,0.4,True,"a nightclub in Saint-Tropez, France that is the main setting of the film.",0.79,True,a drag nightclub,0.3,True,a drag club,0.7709,True
Where was the Fiddler in the musical's title?,on the roof,0.68,True,On the Roof,0.73,True,on the roof,0.5,True,on the roof,0.7898000000000001,True
South Pacific was set during which war?,world war ii,0.84,True,World War II,0.75,True,world war ii,1.0,True,world war ii,0.7955,True
What percentage of the earth's surface is covered by Europe?,68,0.38,False,7%,0.73,False,about 68,0.2,True,68,0.9618,False
Which European town gave its name to a Treaty which symbolizes closer economic links between European countries?,maastricht,0.82,True,Maastricht,0.73,True,maastricht,0.7,True,maastricht,0.9828,True
Which home of champagne in France was also where the German High Command surrendered in WWII?,compiègne forest,0.63,False,The Compiègne Forest,0.73,False,compiègne forest,0.2,False,rheims,0.8674999999999999,True
Which was the first European city this century to open an underground railway system?,glasgow,0.38,False,"London, in 1890",0.83,False,london,0.2,False,glasgow,0.9549,False
Who first drew Mickey Mouse when ?Disney first supplied the voice?,ub iwerks,0.7,True,Ub Iwerks in 1928,0.79,True,ub iwerks,0.2,True,ub iwerks,0.9996,True
Which actress wrote the novel The Last of the Really Great Whangdoodles?,julie andrews,0.45,True,Joyce Carol Oates,0.79,False,julie andrews,0.5,True,julie andrews,0.7378,True
Who was the star of the film based on the record Harper Valley PTA by Jeannie C Riley?,shirley jones,0.46,False,Sharon Stone,0.42,False,shirley jones,0.5,False,shirley jones,0.7801,False
What color golf balls are used on the golf course in Antarctica?,white,0.48,False,White,0.59,False,theyre probably blue but it depends on the course,0.1,False,white,0.7559,False
Throughout the 80s and 90s Phil Collins recorded on which record label?,virgin records,0.34,False,Virgin Records,0.75,False,virgin records,0.4,False,atlantic,0.5325,True
On which label did Chuck Berry record in the 1950s and 1960s?,chess records,0.83,True,Chess Records,0.78,True,chess records,1.0,True,chess records,0.7502,True
What was the name of Michael Jackson's second wife?,lisa marie presley,0.74,False,"None, Michael Jackson only married twice to Lisa Marie Presley and Deborah Rowe, so he did not have a second wife.",0.85,True,lisa marie presley,0.4,False,lisa marie presley,0.902,False
Which US city was named after a British Prime Minister?,Washington D.C.,0.28,False,Washington D.C.,0.95,False,washington,0.2,False,washington dc,0.5145,False
"""Who said, To err is human but it feels divine?""""""",Voltaire,0.22,False,Voltaire,0.75,False,oscar wilde,0.5,False,marie antoinette,0.6662,False
Which singer had a big 60s No 1 with Roses Are Red?,bobby vinton,0.39,True,Tom Jones,0.73,False,bobby vinton,0.4,True,bobby vinton,0.6678,True
What are the international registration letters of a vehicle from Iceland?,IS,0.28,True,IS,0.95,True,is,0.3,True,ísl,0.5051,False
Where was the American venue of the Live Aid concert?,john f kennedy stadium,0.85,False,"John F. Kennedy Stadium in Philadelphia, Pennsylvania",0.92,True,john f kennedy stadium,0.6,False,john f kennedy stadium,0.9752,True
Which was the longest moon landing?,apollo 17,0.72,True,Apollo 17,0.83,True,apollo 17,0.3,True,apollo 17,0.9529,True
Who had the most expensive presidential inauguration ceremony of the 20th century?,franklin d roosevelt,0.36,False,John F. Kennedy,0.59,False,john f kennedys inauguration,0.2,False,franklin d roosevelt,0.8886000000000001,False
Who became Israel's head of state in 1993?,ezer weizman,0.91,True,Ezer Weizman,0.72,True,ezer weizman,1.0,True,ezer weizman,0.9965,True
"In WWII, who was the head of the Nazi party's security service?",heinrich himmler,0.79,False,Heinrich Himmler,0.83,False,heinrich himmler,0.5,False,heinrich himmler,0.99,False
Which President of the Philippines was deposed in 1986?,ferdinand marcos,0.98,True,Ferdinand Marcos,0.92,True,ferdinand marcos,1.0,True,ferdinand marcos,0.9998,True
"What kind of disaster claimed some 100,000 lives in Armenia in 1988?",earthquake,0.81,True,Earthquake,0.83,True,earthquake,0.6,True,earthquake,0.963,True
Which state on the Gulf of Mexico is nearest the end of the alphabet?,texas,0.76,True,Texas,0.79,True,texas,0.8,True,texas,0.6964,True
Truax Field international airport is in which US state?,wisconsin,0.61,True,Washington,0.83,False,wisconsin,0.9,True,wisconsin,0.8412,True
In what month was the attack on Pearl Harbor?,december,0.96,True,December,0.95,True,december,1.0,True,december,0.9473,True
Who did Dr. Crippen murder?,helen barlow,0.22,False,Ethel Le Neve,0.55,False,his wife cora,0.3,True,helen barlow,0.5593,False
"In the 1904 Olympics, how many of the 23 track and field titles were won by Americans?",12 medals,0.49,False,12,0.75,False,12 medals,0.1,False,12,0.5881000000000001,False
The Black Hills lie between which two rivers?,the cheyenne and belle fourche,0.62,False,Cheyenne River and Belle Fourche River,0.83,True,the cheyenne and belle fourche,0.1,False,cheyenne and belle fourche,0.851,True
In what year was the first in-flight movie shown on an internal flight in the USA.,1939,0.24,False,1939,0.79,False,1933,0.4,False,1951,0.7783,False
In which city was John Lennon murdered?,new york city,0.84,True,New York City,0.85,True,new york city,1.0,True,new york city,0.7239,True
How was President Kennedy assassinated?,shot by lee harvey oswald,0.76,True,"He was shot by Lee Harvey Oswald in Dallas, Texas.",0.95,True,shot by lee harvey oswald,0.5,True,shot by lee harvey oswald,0.8029,True
Which caped crusader operated in Gotham City?,batman,0.89,True,Batman,0.95,True,batman,1.0,True,batman,0.7711,True
Who did Jack Ruby shoot in November 1963?,lee harvey oswald,0.93,True,Lee Harvey Oswald,0.85,True,lee harvey oswald,1.0,True,lee harvey oswald,0.9335,True
Who was the first American to travel faster than the speed of sound?,chuck yeager,0.91,True,Chuck Yeager,0.85,True,chuck yeager,0.9,True,chuck yeager,0.9712,True
Who was the first US president Barbara Walters interviewed?,john f kennedy,0.6,False,Richard Nixon,0.71,True,john f kennedy,0.2,False,richard nixon,0.8143,True
Which orchestral conductor was married to one of the subjects of the film Hillary and Jackie?,daniel barenboim,0.68,True,Daniel Barenboim,0.65,True,daniel barenboim,0.3,True,daniel barenboim,0.9995,True
Which writer and politician became Lord Tweedsmuir?,john buchan,0.89,True,John Buchan,0.83,True,john buchan,1.0,True,john buchan,0.8421,True
In what year was the first Tarzan novel published?,1912,0.91,False,1912,0.95,False,1912,0.9,False,1912,0.8941,False
In which country were motorized ambulances first used?,united states,0.63,False,United States,0.76,False,united states,0.3,False,united states,0.7681,False
What is the Pacific terminus of the Trans Siberian Railway?,vladivostok,0.95,True,Vladivostok,0.95,True,vladivostok,0.9,True,vladivostok,0.9848,True
What is the name of the mountain pass which lies between Pakistan and Afghanistan?,khyber pass,0.49,True,Wakhan Pass,0.72,False,khyber pass,0.4,True,khyber pass,0.9135,True
"What is the name of the group of 1,196 islands in the North Indian Ocean, none bigger than five square miles?",the maldives,0.81,True,The Maldives,0.85,True,the maldives,0.6,True,maldives,0.9456,True
Which Syrian city is said to be the oldest continually inhabited city in the world?,damascus,0.95,True,Damascus,0.83,True,damascus,1.0,True,damascus,0.9929,True
Who was king of France at the time of the French Revolution?,king louis xvi,0.76,True,Louis XVI,0.85,True,king louis xvi,0.6,True,louis xvi,0.8198,True
What is the principal language of Bulgaria?,bulgarian,0.95,True,Bulgarian,0.85,True,bulgarian,1.0,True,bulgarian,0.9769,True
"What is the name of the cathedral in Red Square, Moscow?",st basils cathedral,0.74,True,St Basil's Cathedral,0.95,True,st basils cathedral,0.7,True,st basils cathedral,0.6166,False
Which country is known to its people as Suomen Tasavalta?,finland,0.96,True,Finland,0.92,True,finland,1.0,True,finland,0.9612,True
Which crusade was led by Philip II Augustus of France and Richard I of England?,the third crusade,0.42,True,"The Holy Roman Crusade, also known as the Albigensian Crusade or the Fifth Crusade",0.73,False,the third crusade,0.3,True,third crusade,0.815,True
In which Netherlands city does the United Nations International Court of Justice sit?,the hague,0.97,True,The Hague,0.95,True,the hague,1.0,True,the hague,0.9657,True
"In which battle did Harold II, the last Saxon king, lose his life?",battle of hastings,0.83,True,The Battle of Hastings,0.79,True,battle of hastings,0.7,True,battle of hastings,0.9472,True
Who proclaimed the People's Republic of China in 1949?,mao zedong,0.95,True,Mao Zedong,0.85,True,mao zedong,1.0,True,mao zedong,0.9886,True
"Which wife of Henry VIII had already married twice before she became queen, and married for a fourth time after Henry's death?",catherine parr,0.8,True,Catherine Parr,0.83,True,catherine parr,0.9,True,catherine parr,0.6966,True
In which country is the castle that gives the Habsburg dynasty its name?,switzerland,0.55,True,Austria,0.83,False,switzerland,0.6,True,switzerland,0.919,True
In which parliament has the UK 87 seats for members who are elected for a five0-year term?,House of Commons,0.24,False,House of Commons,0.79,False,house of lords,0.5,False,house of lords,0.7439,False
What was the former name of the British Green Party?,people party,0.54,False,People Party,0.55,True,people party,0.2,False,people party,0.7827999999999999,True
"""What is the more common name of the """"simple plurality"""" system of voting?""",firstpastthepost,0.71,True,First-Past-The-Post (FPTP),0.72,True,firstpastthepost,0.5,True,firstpastthepost,0.8547,True
What word for unthinking patriotism is derived from the name of one of Napoleon's admirers?,bonapartism,0.37,False,Jingoism,0.79,False,chauvinism,0.4,True,bonapartism,0.9185,False
Which builder of steam engines formed a successful partnership with Matthew Boulton?,james watt,0.95,True,James Watt,0.95,True,james watt,1.0,True,james watt,0.9195,True
What was the nickname of the French singer Edith Piaf?,the sparrow,0.41,False,The Sparrow,0.87,False,the sparrow,0.2,False,la môme piaf,0.8642,False
Whose birthday is celebrated by a public holiday on the third Monday in January in the USA?,martin luther king jrs,0.92,True,Martin Luther King Jr.,0.85,True,martin luther king jrs,1.0,True,martin luther king jr,0.9153,True
What type of coal is brown and fibrous?,lignite,0.91,True,Lignite,0.72,True,lignite,1.0,True,lignite,0.9852,True
What raw material is used for making glass?,silica sand,0.72,True,Silica sand,0.85,True,silica sand,0.5,True,silica sand,0.7864,True
What kind of an organism is a truffle?,fungus,0.75,True,Fungus,0.92,True,fungus,0.3,True,fungus,0.9618,True
What is the name of the strong material found in plant cell walls?,cellulose,0.95,True,cellulose,0.83,True,cellulose,1.0,True,cellulose,0.9943,True
What name is given to the change of state from liquid to gas?,vaporisation,0.71,False,Vaporization,0.68,True,vaporisation,0.4,False,vaporization,0.9733,True
"Which branch of science has four fundamental principles: addition, subtraction, multiplication, and division.",mathematics,0.77,True,Arithmetic,0.79,True,mathematics,0.6,True,arithmetic,0.8912,True
What is the force that opposes the relative motion of two bodies that are in contact?,friction,0.92,True,friction,0.95,True,friction,0.8,True,friction,0.9934,True
What is the fastest animal on two legs?,the ostrich,0.85,True,Ostrich,0.81,True,the ostrich,0.7,True,ostrich,0.9811,True
What is the green pigment used by plants to trap sunlight?,chlorophyll,0.98,True,Chlorophyll,0.95,True,chlorophyll,1.0,True,chlorophyll,0.9968,True
What id the name given to the study of birds?,ornithology,0.98,True,Ornithology,0.95,True,ornithology,1.0,True,ornithology,0.9915,True
"Of which reptile are there only two species, one living in the Mississippi and the other in China?",alligator,0.75,True,Alligator,0.82,True,alligator,0.6,True,alligator,0.8085,True
"What type of seaweed grows up to 100 meters in length, and is farmed for its alginates?",kelp,0.86,True,Kelp,0.83,True,kelp,0.9,True,kelp,0.855,True
Where in a vertebrate would you find the protein myoglobin?,muscle tissue,0.74,True,"Muscle tissue of red-blooded animals, specifically in slow-twitch fibers.",0.85,True,muscle tissue,0.6,True,muscle tissue,0.7551,True
"What is the most abundant substance in the plant kingdom, which no mammal produces the enzyme to digest?",cellulose,0.94,True,Cellulose,0.92,True,cellulose,0.9,True,cellulose,0.9901,True
"Which family of insects has species named 'drivers', 'weavers', 'and even individuals called 'soldiers'?",ants,0.54,True,Termites,0.72,False,ants,0.5,True,termites,0.9684,False
What name is given to the study of animal behavior?,ethology,0.94,True,Ethology,0.83,True,ethology,1.0,True,ethology,0.9721,True
Mosses are classified as belonging to which part of the plant kingdom?,bryophyta division,0.69,True,Bryophytes,0.83,True,bryophyta division,0.3,True,bryophyta,0.8658,True
"Which rodent rears its young, called kittens, in a nest called a drey?",squirrel,0.84,True,squirrel,0.83,True,squirrel,0.7,True,squirrel,0.9587,True
What has a central vein called a midrib?,leaves,0.85,True,A leaf,0.89,True,leaves,0.8,True,leaves,0.8662,True
"Which mammal constructs a lodge in which to store food, rear young, and pass the winter?",beaver,0.91,True,Beaver,0.83,True,beaver,0.9,True,beaver,0.975,True
What is the generic word for plants that grow in water or water-logged conditions?,aquatics,0.78,False,hydrophytes,0.79,True,aquatics,0.5,False,hydrophytes,0.9795,True
"Which teeth are the third molars, and are always the last to0 erupt?",wisdom teeth,0.8,True,Wisdom teeth,0.95,True,wisdom teeth,0.4,True,wisdom teeth,0.9822,True
What is secreted by the pancreas to regulate blood sugar levels?,insulin and glucagon,0.49,True,Insulin and glucagon,0.83,True,insulin and glucagon,0.8,True,insulin,0.9669,True
How many chambers has the heart?,four,0.83,True,4,0.95,True,four,0.6,True,four,0.9096,True
What is the name of the large buttock and thigh muscle?,gluteus maximus,0.84,True,Gluteus Maximus,0.89,True,gluteus maximus,0.6,True,gluteus,0.9846,True
"When the egg is released from the ovary, what is left behind?",corpus luteum,0.49,True,The follicle is left behind.,0.75,False,corpus luteum,0.3,True,corpus luteum,0.9908,True
What is the scientific name for the heart's pacemaker?,sinoatrial node san,0.71,True,SA node,0.83,True,sinoatrial node san,0.3,True,sinoatrial node,0.9366,True
Which hormone helps control ovulation?,estrogen,0.46,False,Estrogen and Luteinizing Hormone (LH),0.83,True,estrogen,0.2,False,estrogen,0.9904,False
What is the second most common gas in the atmosphere?,oxygen,0.6,True,Nitrogen,0.92,False,oxygen,0.7,True,oxygen,0.9825,True
What is the term for nutrient enrichment of lakes?,eutrophication,0.95,True,Eutrophication,0.83,True,eutrophication,1.0,True,eutrophication,0.9943,True
Five-legged creatures have damaged which 1250 mile long wonder of the world?,the great wall of china,0.63,False,The Great Wall of China,0.56,False,the great wall of china,0.6,False,the great wall of china,0.7004,False
Which radioactive substance sometimes occurs naturally in spring water?,radium,0.51,False,Radon,0.82,True,radium,0.4,False,radium,0.9847,True
What is the approximate circumference of the earth?,40075 kilometers,0.88,False,"40,075 kilometers",0.85,False,40075 kilometers,0.9,False,40075 kilometers,0.8831,False
"Which common mineral is used to make casts, moulds, blackboard chalk and plaster of Paris?",gypsum,0.87,True,Gypsum,0.79,True,gypsum,0.8,True,gypsum,0.9805,True
What name was given to the invisible material once thought to occupy all space?,ether,0.81,True,ether,0.7,True,ether,0.7,True,ether,0.9787,True
From which areas of space can there be no escape?,event horizons of black holes,0.7,True,"Black Holes, Event Horizons and Singularities",0.89,True,event horizons of black holes,0.3,True,event horizons,0.8685,True
Who was the first man to walk on the Moon?,neil armstrong,0.98,True,Neil Armstrong,0.95,True,neil armstrong,1.0,True,neil armstrong,0.9925,True
Proteus and Nereid are moons of which planet?,neptune,0.82,True,Neptune,0.85,True,neptune,0.9,True,neptune,0.7268,True
What is the Milky Way?,"The galaxy that contains our solar system, consisting of hundreds of billions of stars.",0.28,True,"The galaxy that contains our solar system, consisting of hundreds of billions of stars.",0.92,True,galactic star system,0.3,True,galactic spiral galaxy,0.49139999999999995,False
Which force is nothing more than the bending of space and time?,gravity,0.89,True,Gravity,0.89,True,gravity,0.8,True,gravity,0.9686,True
"Which star is as bright as 23 Suns, and is orbited by the Pup?",sirius,0.54,True,Sirius,0.79,True,sirius b,0.1,True,sirius,0.7559,True
What are the three primary colours of light?,red blue and green,0.4,True,"Red, Green and Blue",0.95,False,red blue and green,0.4,True,red green blue,0.8899,False
In what film did Oprah Winfrey make her big screen acting debut?,the color purple,0.82,True,The Color Purple,0.8,True,the color purple,0.7,True,the color purple,0.9312,True
What is the second lightest chemical element?,lithium,0.48,False,Neon,0.83,False,lithium,0.3,False,lithium,0.9662,False
"Used in mathematics, what is the value of Pi to three decimal places?",3142,0.39,False,3.142,0.95,True,3142,0.9,True,3142,0.982,False
"What colour is the number 10 on the door of 10 Downing Street? White, Yellow or Brown?",yellow,0.5,False,Yellow,0.43,False,white,0.6,True,yellow,0.921,False
What was advertised with Eva Herzagovia using the slogan hello boys?,calvin klein jeans,0.46,False,Calvin Klein jeans,0.72,False,calvin klein perfume,0.2,False,calvin klein jeans,0.6192,False
What number in Bingo is sometimes referred to as Heinz varieties?,57,0.88,True,57,0.62,True,57,1.0,True,57,0.9854,True
"As at March 2001, who holds the record for scoring the most league goals for the soccer team Arsenal?",thierry henry and ian wright are level on some 147 goals but then david jack is now,0.66,True,Thierry Henry,0.79,False,thierry henry and ian wright are level on some 147 goals but then david jack is now,0.1,True,thierry henry,0.9832,False
How many verses make up the national anthem God Save The Queen?,four,0.61,False,4 verses,0.7,False,four,0.6,False,four,0.5393,False
What colour is the cross on the national flag of Switzerland?,white,0.77,True,white,0.78,True,white,0.6,True,white,0.8951,True
Who was the American President when the Berlin Wall was constructed?,dwight d eisenhower,0.73,False,Dwight D. Eisenhower,0.72,False,dwight d eisenhower,0.6,False,dwight eisenhower,0.83,False
What is the minimum number of darts a person needs to throw to complete a leg from 501?,9,0.28,True,9,0.95,True,2,0.1,False,three,0.8448,False
What was the first British football team to win the European Cup?,liverpool,0.34,False,Aston Villa,0.72,False,nottingham forest,0.3,False,liverpool,0.8489,False
What is the most popular natural attraction in Alaska?,denali national park and preserve,0.63,True,Denali National Park and Preserve,0.72,False,denali national park and preserve,0.4,True,denali national park,0.7249,False
"What type of acid is extracted from the juice of lemons, oranges, limes, and grapefruit?",citric acid,0.92,True,Citric Acid,0.95,True,citric acid,1.0,True,citric acid,0.8493999999999999,True
How many pieces are there in a standard set of dominoes?,28 pieces,0.63,True,28,0.72,True,28 pieces,0.5,True,28 pieces,0.6604,True
What is the acronym for the agency which provides co-operation between police forces worldwide?,interpol,0.85,True,INTERPOL,0.92,True,interpol,0.8,True,interpol,0.8269,True
"What were Benjy and Laska, which were sent into space in 1958?",Dogs,0.24,False,Dogs,0.79,False,laikas companions laika was alone,0.1,True,laikas companions,0.5644,False
In what year in the 20th century was the Miss World contest held for the first time?,1951,0.93,True,1951,0.79,True,1951,1.0,True,1951,0.9786,True
In which year was the Encyclopedia Britannica first published?,1768,0.81,True,1768,0.95,True,1768,0.6,True,1768,0.8735999999999999,True
"On the London Underground, which is the only line to connect at some point with every other line on the system?",victoria line,0.62,False,Victoria Line,0.73,False,victoria line,0.3,False,victoria line,0.7721,False
Who wrote The Importance Of Being Earnest?,oscar wilde,0.96,True,Oscar Wilde,0.95,True,oscar wilde,1.0,True,oscar wilde,0.9335,True
"Thomas Edison, who invented the lightbulb, was afraid of the dark?",irony,0.39,False,"Yes, it is true that Thomas Edison was afraid of the dark.",0.57,True,fascinating irony,0.1,False,irony,0.9858,False
Taphephobia is the fear of losing your teeth?,odontophobia,0.45,False,"odontophobia is the fear of losing your teeth, taphephobia is actually the fear of being buried alive.",0.95,False,odontophobia,0.3,False,odontophobia,0.8931,False
The letter t is the second most common letter used in the English language?,false,0.45,False,yes,0.75,False,false,0.2,False,incorrect,0.9809,False
"The invention of what in 1867, made Alfred Nobel famous?",dynamite,0.98,True,dynamite,0.95,True,dynamite,1.0,True,dynamite,0.9871,True
What is the most populated city in America?,new york city,0.91,True,New York City,0.95,True,new york city,0.9,True,new york city,0.8855999999999999,True
What is the only letter of the alphabet which does not appear in any of the names of the 50 American states?,Q,0.28,True,Q,0.92,True,j,0.6,True,q,0.5646,True
What was the Spice Girls' debut single called?,wannabe,0.93,True,Wannabe,0.95,True,wannabe,1.0,True,wannabe,0.8702,True
What are the only two musical notes which have no flats?,b and f,0.66,False,B and F,0.92,False,b and f,0.4,False,b and f,0.6655,False
"From which country do French fries originate? France, Belgium or Switzerland?",belgium,0.95,False,Belgium,0.85,False,belgium,1.0,False,belgium,0.9788,False
For what novel did J. K. Rowling win the 1999 Whitbread Children's book of the year award?,harry potter and the prisoner of azkaban,0.93,True,Harry Potter and the Prisoner of Azkaban,0.79,True,harry potter and the prisoner of azkaban,1.0,True,harry potter and the prisoner of azkaban,0.9858,True
